queries,answers
What courses are offered at your college?,"We offer B.Tech, M.Tech, MBA, and MCA programs."
Can you tell me about the B.Tech program?,B.Tech is a 4-year undergraduate engineering program with various specializations.
What is the duration of the MBA course?,The MBA course is a 2-year full-time program.
How long is the MCA program?,The MCA program is 3 years long.
Is M.Tech available at your institution?,"Yes, we offer a 2-year M.Tech program in multiple disciplines."
What is the fee for B.Tech?,"The B.Tech program fee is ?1,20,000 per year."
How much does M.Tech cost annually?,"The M.Tech fee is ?1,40,000 per year."
What is the MBA tuition fee?,"The MBA tuition fee is ?1,50,000 per year."
How much do I pay for MCA per year?,"MCA costs ?1,00,000 per year."
Are scholarships available for students?,"Yes, we offer merit-based scholarships of up to ?50,000."
What scholarships do you offer?,We offer merit-based and category-based scholarships.
Is there financial aid for economically weaker sections?,"Yes, we provide support for EWS and reserved category students."
How can I apply for admission?,You can apply online through our official website and follow the instructions.
Do you conduct any entrance exam for admission?,"Yes, admissions are based on an entrance exam followed by counseling."
What are the eligibility criteria for B.Tech?,"You need to have completed 10+2 with Physics, Chemistry, and Mathematics."
What are the eligibility requirements for MBA?,A valid bachelor’s degree and qualifying entrance exam are required.
Can I apply offline?,"No, all applications are accepted online only."
When does the admission process start?,The admission process typically begins in April every year.
Do you have a hostel facility?,"Yes, we have separate hostels for boys and girls."
Are hostels Wi-Fi enabled?,"Yes, all hostels are equipped with high-speed Wi-Fi."
Do hostels have mess facilities?,"Yes, hygienic and nutritious food is served in our hostel mess."
How are the placements?,We have a 90% placement rate with top companies visiting our campus.
What companies visit for placement?,"Infosys, TCS, Amazon, Wipro, and many others recruit our students."
Is internship support provided?,"Yes, we assist students with internship opportunities in reputed firms."
Do you conduct campus drives?,"Yes, regular campus drives are organized for final-year students."
What is the average salary offered during placement?,The average salary is around ?6 LPA with the highest going up to ?18 LPA.
Is there any entrance exam for MCA?,"Yes, admission to MCA is based on an entrance test and academic merit."
How many seats are there for B.Tech?,We have over 300 seats across B.Tech specializations.
What are the available specializations in B.Tech?,"We offer CSE, ECE, ME, CE, and IT in B.Tech."
What documents are needed for admission?,"You need marksheets, ID proof, entrance scorecard, and photographs."
What is the application fee?,"The application fee is ?1,000, payable online."
Can I pay the fee in installments?,"Yes, the annual fee can be paid in two installments."
What modes of fee payment are accepted?,"We accept online payments via UPI, net banking, and credit/debit cards."
What’s the college location?,"Our college is located in [City], easily accessible by public transport."
Is there transportation available?,"Yes, college buses are available from key points in the city."
Are there any student clubs?,"Yes, we have technical, cultural, and entrepreneurship clubs."
Do you offer foreign exchange programs?,"Yes, selected students can participate in short-term global internships."
What is the college timing?,"Classes typically run from 9 AM to 4 PM, Monday to Friday."
Is ragging allowed?,No. Our campus is strictly anti-ragging and under CCTV surveillance.
Is the campus Wi-Fi enabled?,"Yes, the entire campus is Wi-Fi enabled for students and staff."
Do you have a library?,"Yes, we have a central library with thousands of academic resources."
Can I change my branch after admission?,Branch change is allowed after first year based on academic performance.
Are there any entrance exams conducted by the college itself?,"Yes, we conduct an in-house entrance test for some programs."
Do you offer lateral entry for diploma holders?,"Yes, diploma holders can apply for lateral entry to the 2nd year of B.Tech."
What is the total cost for an MBA degree?,"The total cost for 2 years of MBA is ?3,00,000."
Is placement guaranteed?,"While we ensure support, placement depends on student performance."
Are online classes available?,"Yes, we offer hybrid learning and online support when needed."
Can international students apply?,"Yes, we accept applications from international students."
What is the refund policy for admission fees?,Refunds are available as per UGC guidelines before course commencement.
Are there any sports facilities?,"Yes, we have indoor and outdoor sports grounds and equipment."
What is the last date to apply for UG programs?,The last date to apply for undergraduate programs is typically around June 30. Please check the MSRUAS official admissions page for updates.
Are evening or weekend classes available for working professionals?,"Yes, MSRUAS offers flexible learning options like part-time or weekend classes for select postgraduate and diploma programs."
What is the minimum eligibility for B.Sc. in Biotechnology?,"Candidates must have passed 10+2 with Biology, Physics, and Chemistry as core subjects. A minimum of 50% aggregate marks is typically required."
Is hostel accommodation available on campus?,"Yes, MSRUAS provides separate hostel facilities for boys and girls with dining, Wi-Fi, laundry, and security services."
How can I apply for MSRUAS scholarships?,"You can apply for scholarships during the admission process. Scholarships are awarded based on academic merit, sports, or socio-economic background."
Are there any entrance exams for admission to MSRUAS?,"Some courses may require entrance tests like RUAS-AT or national-level exams. For most UG programs, admission is based on merit in qualifying exams."
Can I get lateral entry into B.Tech programs?,"Yes, students with a 3-year diploma in engineering can apply for lateral entry into the 2nd year of B.Tech at MSRUAS."
Is there a counseling process for admissions?,"Yes, once applications are reviewed, shortlisted candidates are invited for counseling and document verification."
Does MSRUAS offer international student admissions?,"Yes, international students can apply with valid academic transcripts, English proficiency scores (like IELTS/TOEFL), and visa documents."
What documents are required during admission?,"You’ll need your 10th & 12th mark sheets, transfer certificate, ID proof, recent passport-size photos, and entrance exam scorecard if applicable."
What is the medium of instruction at MSRUAS?,English is the medium of instruction for all undergraduate and postgraduate programs.
Does the university offer placement support?,"Yes, MSRUAS has a dedicated placement cell that provides training, industry tie-ups, and placement opportunities across various sectors."
Are online classes available for any programs?,"Some programs may offer online or hybrid learning modes, especially postgraduate diplomas or certificate courses."
Can I switch branches after joining a program?,"Branch change may be allowed after the first year, subject to academic performance and availability of seats."
How do I check the status of my admission application?,You can log in to the admission portal using your application number and registered email to check the current status.
What is the fee structure for B.Tech in Artificial Intelligence?,The fee structure for B.Tech in AI & ML varies by academic year. Please visit the official MSRUAS fees page or contact the admissions office for the latest details.
Are there any dual-degree programs offered?,"Yes, MSRUAS offers integrated and dual-degree options in engineering and management streams. Check the course catalog for details."
Can I pay the fees in installments?,"Yes, the university allows semester-wise installment payments. Some scholarship and financial aid programs may offer further flexibility."
Is there a refund policy if I cancel my admission?,"Yes, MSRUAS follows UGC refund guidelines. Refund eligibility depends on the date of withdrawal and applicable deductions."
Does MSRUAS have a medical facility on campus?,"Yes, the university has a health center with basic medical care, a resident doctor, and tie-ups with nearby hospitals"
What are the career prospects after M.Tech in Robotics?,"M.Tech in Robotics graduates can work in automation, defense, aerospace, manufacturing, and R&D sectors. MSRUAS also assists with placements."
Is there a dress code on campus?,"While there’s no strict dress code, students are expected to wear modest and appropriate attire. Some departments (like Dental or Pharmacy) may require uniforms."
How do I contact the admissions helpdesk?,"You can reach the MSRUAS admissions team via phone, email, or the live chat feature on their website. Timings are usually 9 AM to 5 PM on working days."
Are internships mandatory during the course?,"Yes, many UG and PG programs include mandatory internships or industry projects as part of the curriculum."
Can I get admission through sports quota?,MSRUAS offers limited seats under sports quota. You’ll need to provide district/state/national-level certificates and attend trials.
Are there any foreign language courses offered?,"Yes, the university offers foreign language electives such as German, French, and Japanese, based on student interest and program."
How many credits are required to graduate?,"Typically, UG programs require 160–180 credits, while PG programs range from 70–90 credits, depending on the course structure."
Does the university provide transportation facilities?,"Yes, MSRUAS offers bus services across various city routes. Transport fees are separate and depend on the distance from campus."
What kind of extracurricular clubs are available?,"Students can join clubs for dance, music, photography, robotics, literature, and entrepreneurship, among others."
Can I defer my admission to next year?,Admission deferment may be granted on valid grounds. You’ll need to submit a formal request to the admissions office before the session starts.
